texto,Número de Palavras,Número de Caracteres,Frequência de Palavras,timestamp
"O tempo escorre pelas frestas da rotina.
O tempo não avisa quando vai acelerar.
O tempo some quando estamos felizes.
O tempo pesa quando a saudade aperta.
O tempo ensina, mas também apaga.
O tempo é mestre, juiz e espectador.
O tempo não espera ninguém.
O tempo, às vezes, parece cruel.
Mas o tempo também cura.
O tempo nos transforma, mesmo em silêncio.
E quando tudo acaba, só o tempo permanece.",71,380,O: 9<br>tempo: 11<br>escorre: 1<br>pelas: 1<br>frestas: 1<br>da: 1<br>rotina: 1<br>não: 2<br>avisa: 1<br>quando: 4<br>vai: 1<br>acelerar: 1<br>some: 1<br>estamos: 1<br>felizes: 1<br>pesa: 1<br>a: 1<br>saudade: 1<br>aperta: 1<br>ensina: 1<br>mas: 1<br>também: 2<br>apaga: 1<br>é: 1<br>mestre: 1<br>juiz: 1<br>e: 1<br>espectador: 1<br>espera: 1<br>ninguém: 1<br>às: 1<br>vezes: 1<br>parece: 1<br>cruel: 1<br>Mas: 1<br>o: 2<br>cura: 1<br>nos: 1<br>transforma: 1<br>mesmo: 1<br>em: 1<br>silêncio: 1<br>E: 1<br>tudo: 1<br>acaba: 1<br>só: 1<br>permanece: 1,2025-05-24 11:11:47.925476
,,,,2025-05-24 11:12:01.386708
